[
  {
    "id": 1,
    "start_sec": 0.0,
    "end_sec": 6.73,
    "duration": 6.73
  },
  {
    "id": 2,
    "start_sec": 6.73,
    "end_sec": 9.63,
    "duration": 2.9
  },
  {
    "id": 3,
    "start_sec": 9.63,
    "end_sec": 12.1,
    "duration": 2.47
  },
  {
    "id": 4,
    "start_sec": 12.1,
    "end_sec": 21.4,
    "duration": 9.3
  },
  {
    "id": 5,
    "start_sec": 21.4,
    "end_sec": 28.63,
    "duration": 7.23
  },
  {
    "id": 6,
    "start_sec": 28.63,
    "end_sec": 32.13,
    "duration": 3.5
  },
  {
    "id": 7,
    "start_sec": 32.13,
    "end_sec": 35.83,
    "duration": 3.7
  },
  {
    "id": 8,
    "start_sec": 35.83,
    "end_sec": 40.97,
    "duration": 5.14
  },
  {
    "id": 9,
    "start_sec": 40.97,
    "end_sec": 43.03,
    "duration": 2.06
  },
  {
    "id": 10,
    "start_sec": 43.03,
    "end_sec": 46.87,
    "duration": 3.84
  },
  {
    "id": 11,
    "start_sec": 46.87,
    "end_sec": 49.43,
    "duration": 2.56
  },
  {
    "id": 12,
    "start_sec": 49.43,
    "end_sec": 51.1,
    "duration": 1.67
  },
  {
    "id": 13,
    "start_sec": 51.1,
    "end_sec": 53.37,
    "duration": 2.27
  },
  {
    "id": 14,
    "start_sec": 53.37,
    "end_sec": 55.13,
    "duration": 1.76
  },
  {
    "id": 15,
    "start_sec": 55.13,
    "end_sec": 58.1,
    "duration": 2.97
  },
  {
    "id": 16,
    "start_sec": 58.1,
    "end_sec": 60.13,
    "duration": 2.03
  },
  {
    "id": 17,
    "start_sec": 60.13,
    "end_sec": 67.33,
    "duration": 7.2
  },
  {
    "id": 18,
    "start_sec": 67.33,
    "end_sec": 70.8,
    "duration": 3.47
  },
  {
    "id": 19,
    "start_sec": 70.8,
    "end_sec": 72.87,
    "duration": 2.07
  },
  {
    "id": 20,
    "start_sec": 72.87,
    "end_sec": 74.4,
    "duration": 1.53
  },
  {
    "id": 21,
    "start_sec": 74.4,
    "end_sec": 75.8,
    "duration": 1.4
  },
  {
    "id": 22,
    "start_sec": 75.8,
    "end_sec": 77.17,
    "duration": 1.37
  },
  {
    "id": 23,
    "start_sec": 77.17,
    "end_sec": 80.43,
    "duration": 3.26
  },
  {
    "id": 24,
    "start_sec": 80.43,
    "end_sec": 81.43,
    "duration": 1.0
  },
  {
    "id": 25,
    "start_sec": 81.43,
    "end_sec": 82.93,
    "duration": 1.5
  },
  {
    "id": 26,
    "start_sec": 82.93,
    "end_sec": 83.93,
    "duration": 1.0
  },
  {
    "id": 27,
    "start_sec": 83.93,
    "end_sec": 85.43,
    "duration": 1.5
  },
  {
    "id": 28,
    "start_sec": 85.43,
    "end_sec": 91.47,
    "duration": 6.04
  },
  {
    "id": 29,
    "start_sec": 91.47,
    "end_sec": 92.63,
    "duration": 1.16
  },
  {
    "id": 30,
    "start_sec": 92.63,
    "end_sec": 95.03,
    "duration": 2.4
  },
  {
    "id": 31,
    "start_sec": 95.03,
    "end_sec": 96.83,
    "duration": 1.8
  },
  {
    "id": 32,
    "start_sec": 96.83,
    "end_sec": 99.1,
    "duration": 2.27
  },
  {
    "id": 33,
    "start_sec": 99.1,
    "end_sec": 100.1,
    "duration": 1.0
  },
  {
    "id": 34,
    "start_sec": 100.1,
    "end_sec": 100.87,
    "duration": 0.77
  },
  {
    "id": 35,
    "start_sec": 100.87,
    "end_sec": 101.4,
    "duration": 0.53
  },
  {
    "id": 36,
    "start_sec": 101.4,
    "end_sec": 102.03,
    "duration": 0.63
  },
  {
    "id": 37,
    "start_sec": 102.03,
    "end_sec": 107.63,
    "duration": 5.6
  },
  {
    "id": 38,
    "start_sec": 107.63,
    "end_sec": 110.87,
    "duration": 3.24
  },
  {
    "id": 39,
    "start_sec": 110.87,
    "end_sec": 112.47,
    "duration": 1.6
  },
  {
    "id": 40,
    "start_sec": 112.47,
    "end_sec": 114.47,
    "duration": 2.0
  },
  {
    "id": 41,
    "start_sec": 114.47,
    "end_sec": 116.0,
    "duration": 1.53
  },
  {
    "id": 42,
    "start_sec": 116.0,
    "end_sec": 118.97,
    "duration": 2.97
  },
  {
    "id": 43,
    "start_sec": 118.97,
    "end_sec": 120.8,
    "duration": 1.83
  },
  {
    "id": 44,
    "start_sec": 120.8,
    "end_sec": 122.37,
    "duration": 1.57
  },
  {
    "id": 45,
    "start_sec": 122.37,
    "end_sec": 123.7,
    "duration": 1.33
  },
  {
    "id": 46,
    "start_sec": 123.7,
    "end_sec": 129.4,
    "duration": 5.7
  },
  {
    "id": 47,
    "start_sec": 129.4,
    "end_sec": 132.6,
    "duration": 3.2
  },
  {
    "id": 48,
    "start_sec": 132.6,
    "end_sec": 133.87,
    "duration": 1.27
  },
  {
    "id": 49,
    "start_sec": 133.87,
    "end_sec": 136.27,
    "duration": 2.4
  },
  {
    "id": 50,
    "start_sec": 136.27,
    "end_sec": 137.67,
    "duration": 1.4
  },
  {
    "id": 51,
    "start_sec": 137.67,
    "end_sec": 138.93,
    "duration": 1.26
  },
  {
    "id": 52,
    "start_sec": 138.93,
    "end_sec": 140.2,
    "duration": 1.27
  },
  {
    "id": 53,
    "start_sec": 140.2,
    "end_sec": 144.2,
    "duration": 4.0
  },
  {
    "id": 54,
    "start_sec": 144.2,
    "end_sec": 147.63,
    "duration": 3.43
  },
  {
    "id": 55,
    "start_sec": 147.63,
    "end_sec": 149.9,
    "duration": 2.27
  },
  {
    "id": 56,
    "start_sec": 149.9,
    "end_sec": 153.47,
    "duration": 3.57
  },
  {
    "id": 57,
    "start_sec": 153.47,
    "end_sec": 157.73,
    "duration": 4.26
  },
  {
    "id": 58,
    "start_sec": 157.73,
    "end_sec": 164.1,
    "duration": 6.37
  },
  {
    "id": 59,
    "start_sec": 164.1,
    "end_sec": 166.83,
    "duration": 2.73
  },
  {
    "id": 60,
    "start_sec": 166.83,
    "end_sec": 168.73,
    "duration": 1.9
  },
  {
    "id": 61,
    "start_sec": 168.73,
    "end_sec": 170.3,
    "duration": 1.57
  },
  {
    "id": 62,
    "start_sec": 170.3,
    "end_sec": 171.87,
    "duration": 1.57
  },
  {
    "id": 63,
    "start_sec": 171.87,
    "end_sec": 173.6,
    "duration": 1.73
  },
  {
    "id": 64,
    "start_sec": 173.6,
    "end_sec": 174.47,
    "duration": 0.87
  },
  {
    "id": 65,
    "start_sec": 174.47,
    "end_sec": 175.23,
    "duration": 0.76
  },
  {
    "id": 66,
    "start_sec": 175.23,
    "end_sec": 182.17,
    "duration": 6.94
  },
  {
    "id": 67,
    "start_sec": 182.17,
    "end_sec": 182.9,
    "duration": 0.73
  },
  {
    "id": 68,
    "start_sec": 182.9,
    "end_sec": 185.6,
    "duration": 2.7
  },
  {
    "id": 69,
    "start_sec": 185.6,
    "end_sec": 186.6,
    "duration": 1.0
  },
  {
    "id": 70,
    "start_sec": 186.6,
    "end_sec": 206.33,
    "duration": 19.73
  },
  {
    "id": 71,
    "start_sec": 206.33,
    "end_sec": 210.37,
    "duration": 4.04
  },
  {
    "id": 72,
    "start_sec": 210.37,
    "end_sec": 213.63,
    "duration": 3.26
  },
  {
    "id": 73,
    "start_sec": 213.63,
    "end_sec": 214.93,
    "duration": 1.3
  },
  {
    "id": 74,
    "start_sec": 214.93,
    "end_sec": 218.3,
    "duration": 3.37
  },
  {
    "id": 75,
    "start_sec": 218.3,
    "end_sec": 220.23,
    "duration": 1.93
  },
  {
    "id": 76,
    "start_sec": 220.23,
    "end_sec": 224.8,
    "duration": 4.57
  },
  {
    "id": 77,
    "start_sec": 224.8,
    "end_sec": 226.43,
    "duration": 1.63
  },
  {
    "id": 78,
    "start_sec": 226.43,
    "end_sec": 233.3,
    "duration": 6.87
  },
  {
    "id": 79,
    "start_sec": 233.3,
    "end_sec": 234.8,
    "duration": 1.5
  },
  {
    "id": 80,
    "start_sec": 234.8,
    "end_sec": 236.73,
    "duration": 1.93
  },
  {
    "id": 81,
    "start_sec": 236.73,
    "end_sec": 237.7,
    "duration": 0.97
  },
  {
    "id": 82,
    "start_sec": 237.7,
    "end_sec": 243.67,
    "duration": 5.97
  },
  {
    "id": 83,
    "start_sec": 243.67,
    "end_sec": 245.07,
    "duration": 1.4
  },
  {
    "id": 84,
    "start_sec": 245.07,
    "end_sec": 249.63,
    "duration": 4.56
  },
  {
    "id": 85,
    "start_sec": 249.63,
    "end_sec": 251.97,
    "duration": 2.34
  },
  {
    "id": 86,
    "start_sec": 251.97,
    "end_sec": 256.0,
    "duration": 4.03
  },
  {
    "id": 87,
    "start_sec": 256.0,
    "end_sec": 260.2,
    "duration": 4.2
  },
  {
    "id": 88,
    "start_sec": 260.2,
    "end_sec": 273.2,
    "duration": 13.0
  },
  {
    "id": 89,
    "start_sec": 273.2,
    "end_sec": 277.07,
    "duration": 3.87
  },
  {
    "id": 90,
    "start_sec": 277.07,
    "end_sec": 281.27,
    "duration": 4.2
  },
  {
    "id": 91,
    "start_sec": 281.27,
    "end_sec": 296.37,
    "duration": 15.1
  },
  {
    "id": 92,
    "start_sec": 296.37,
    "end_sec": 306.17,
    "duration": 9.8
  },
  {
    "id": 93,
    "start_sec": 306.17,
    "end_sec": 308.33,
    "duration": 2.16
  }
]